{
  "A53_T23_compatibility": {
    "A53_and_T23_stationary_combination_compatible": false,
    "A53_conditional_ratios": {
      "f2_over_f0": "15/log(448)",
      "h0_over_Lambda_interval": {
        "lower_decimal": "2.216793032723901116392309004510",
        "lower_exact": "221679303272390111639230900451/100000000000000000000000000000",
        "upper_decimal": "2.216793032723901116392309004511",
        "upper_exact": "2216793032723901116392309004511/1000000000000000000000000000000"
      },
      "h0_squared_over_Lambda_squared": "30/log(448)",
      "mass_over_Lambda_interval": {
        "lower_decimal": "4.433586065447802232784618009020",
        "lower_exact": "221679303272390111639230900451/50000000000000000000000000000",
        "upper_decimal": "4.433586065447802232784618009022",
        "upper_exact": "2216793032723901116392309004511/500000000000000000000000000000"
      },
      "mass_squared_over_Lambda_squared": "120/log(448)",
      "mass_squared_over_Lambda_squared_interval": {
        "lower_decimal": "19.656685399732923703500063941970",
        "lower_exact": "2388176435674170054034254151165500327573919318059870972977226180314385804808534717895378634194498172670828162578425148539021512190382659670461923701721541480846040221278859721279028329187384765383920948819881816817593214547531239256963760348036355435257644352722000056760000/121494361185971787393281935280255718645464847706828210640201115219483179621653002292021119472862731609674225484382881906967233591926252409153570817347187577399753848548863765834492490889415294226621346252351963369967370989296069614274959733660553543798843771843690603185347",
        "upper_decimal": "19.656685399732923703500063941970",
        "upper_exact": "37315256807408907094285221111960942618342489344685483952769159067412278200133354967115291159289033947981690040287892945922211127974729057350967557839399085638219378457482183144984817643552886959123764825310653387774893977305175613390058755438068053675900693011281250886875/1898349393530809178020030238753995603835388245419190791253142425304424656235421513741711286697661772777156726574628820635589048542932471388993649439553501629878719202109005723444087912812045878683412631511014932987664793405379388035549004478774045121802860546333967541248"
      }
    },
    "A53_one_atom_premise_selected_by_MTT": false,
    "T23_one_primitive_identification": "h=Lambda=E0=1/L0",
    "exact_exit_options": [
      "retain A53 moments and use h0/Lambda=sqrt(30/log(448))",
      "retain h=Lambda and replace the A53 one-atom ratio by f2/f0=1/2",
      "retain both inputs but add a selected action term so h=Lambda is not the bare tree stationary point"
    ],
    "rho_interval": {
      "lower_decimal": "4.914171349933230925875015985493",
      "lower_exact": "597044108918542513508563537791375081893479829514967743244306545078596451202133679473844658548624543167707040644606287134755378047595664917615480925430385370211510055319714930319757082296846191345980237204970454204398303636882809814240940087009088858814411088180500014190000/121494361185971787393281935280255718645464847706828210640201115219483179621653002292021119472862731609674225484382881906967233591926252409153570817347187577399753848548863765834492490889415294226621346252351963369967370989296069614274959733660553543798843771843690603185347",
      "upper_decimal": "4.914171349933230925875015985493",
      "upper_exact": "37315256807408907094285221111960942618342489344685483952769159067412278200133354967115291159289033947981690040287892945922211127974729057350967557839399085638219378457482183144984817643552886959123764825310653387774893977305175613390058755438068053675900693011281250886875/7593397574123236712080120955015982415341552981676763165012569701217698624941686054966845146790647091108626906298515282542356194171729885555974597758214006519514876808436022893776351651248183514733650526044059731950659173621517552142196017915096180487211442185335870164992"
    },
    "stationarity_with_h_equals_Lambda_requires": "f2/f0=1/2, equivalently tau_int=2",
    "tau_int_exact": "log(448)/15",
    "tau_interval": {
      "lower_decimal": "0.406986215494332344107249698146",
      "lower_exact": "15186795148246473424160241910031964830683105963353526330025139402435397249883372109933690293581294182217253812597030565084712388343459771111949195516428013039029753616872045787552703302496367029467301052088119463901318347243035104284392035830192360974422884370671740329984/37315256807408907094285221111960942618342489344685483952769159067412278200133354967115291159289033947981690040287892945922211127974729057350967557839399085638219378457482183144984817643552886959123764825310653387774893977305175613390058755438068053675900693011281250886875",
      "upper_decimal": "0.406986215494332344107249698146",
      "upper_exact": "121494361185971787393281935280255718645464847706828210640201115219483179621653002292021119472862731609674225484382881906967233591926252409153570817347187577399753848548863765834492490889415294226621346252351963369967370989296069614274959733660553543798843771843690603185347/298522054459271256754281768895687540946739914757483871622153272539298225601066839736922329274312271583853520322303143567377689023797832458807740462715192685105755027659857465159878541148423095672990118602485227102199151818441404907120470043504544429407205544090250007095000"
    }
  },
  "check_summary": {
    "failed": [],
    "passed": 70,
    "total": 70
  },
  "checks": {
    "A51_absolute_normalization_remains_open": true,
    "A51_standard_bosonic_operator_content_is_available": true,
    "A52_strict_moments_remain_open": true,
    "A53_h_over_Lambda_is_certified": true,
    "A53_mass_over_Lambda_is_certified": true,
    "A53_point_measure_is_conditional": true,
    "A53_ratio_is_certified": true,
    "A53_tau_is_available": true,
    "D0_D1_commute": true,
    "D0_square_is_identity": true,
    "T20_source_is_exact": true,
    "T23_h_equals_Lambda_conflicts_with_A53_stationarity": true,
    "T23_source_is_exact": true,
    "T25_source_is_exact": true,
    "T26_coefficients_match_bridge": true,
    "T26_source_is_exact": true,
    "T27_source_is_exact": true,
    "T31_source_is_exact": true,
    "Tr_D1_squared_is_192": true,
    "absolute_scale_remains_unselected": true,
    "broken_branch_stationary_factorization_is_exact": true,
    "cauchy_equality_only_at_zero": true,
    "cauchy_gap_factorization_is_exact": true,
    "cauchy_quadratic_is_positive": true,
    "chamber_cubic_endpoints_are_positive": true,
    "chamber_cubic_has_only_an_interior_maximum": true,
    "contract_schema_is_exact": true,
    "fixed_radial_rho_one_bridge_is_six_times_T26": true,
    "generalized_mass_squared_is_4h_squared_twice": true,
    "handoff_is_pinned": true,
    "joint_kinetic_metric_is_newly_closed_conditionally": true,
    "joint_tree_vacuum_is_newly_closed_conditionally": true,
    "kernel_model_is_pinned": true,
    "kinetic_metric_determinant_is_14h_squared": true,
    "no_fitted_coefficients_used": true,
    "no_observed_values_used": true,
    "nonzero_tree_hierarchy_is_not_selected": true,
    "physical_packet_acceptance_unchanged": true,
    "physical_row_acceptance_unchanged": true,
    "q2_is_strictly_positive": true,
    "source_01_hash_matches": true,
    "source_02_hash_matches": true,
    "source_03_hash_matches": true,
    "source_04_hash_matches": true,
    "source_05_hash_matches": true,
    "source_06_hash_matches": true,
    "source_07_hash_matches": true,
    "source_08_hash_matches": true,
    "source_09_hash_matches": true,
    "source_10_hash_matches": true,
    "source_11_hash_matches": true,
    "source_12_hash_matches": true,
    "source_13_hash_matches": true,
    "source_14_hash_matches": true,
    "source_15_hash_matches": true,
    "source_16_hash_matches": true,
    "source_17_hash_matches": true,
    "source_18_hash_matches": true,
    "source_lock_schema_is_exact": true,
    "source_root_is_nonempty": true,
    "strict_top_level_contract": true,
    "t_field_promotion_remains_unselected": true,
    "tau_interval_excludes_two": true,
    "tau_interval_is_positive": true,
    "trace_q2_matches_branches": true,
    "trace_q4_matches_branches": true,
    "unique_broken_stationary_point_in_neutral_chamber": true,
    "vacuum_hessian_coefficients_are_exact": true,
    "vacuum_hessian_is_8h_squared_times_metric": true,
    "vacuum_metric_coefficients_are_exact": true
  },
  "claim_id": "CBF.T32",
  "conditional_action_scope": {
    "A51_one_Higgs_module_selected": true,
    "adopted_heat_kernel_expansion": "Tr f(D/Lambda)~2f4 Lambda^4 a0+2f2 Lambda^2 a2+f0 a4",
    "background": "flat Euclidean four-dimensional product chart",
    "global_Wick_or_Lorentzian_action_selected": false,
    "overall_positive_factor_suppressed_below": "32 f0/(8pi^2)",
    "product_Dirac_scalar": "Phi(x)=h(x)D_phys(t(x))",
    "requires": [
      "f0>0",
      "f2>0",
      "h is a radial amplitude"
    ],
    "scalar_action": "f0/(8pi^2) Tr[(partial Phi)^2+Phi^4-4(f2 Lambda^2/f0)Phi^2]",
    "t_field_promotion_selected_by_MTT": false,
    "t_field_role": "conditional spacetime source-modulus extension of the CBF finite family",
    "t_is_an_A51_inner_fluctuation": false
  },
  "date": "2026-08-30",
  "exact_trace_data": {
    "Tr_D1_squared": "192",
    "Tr_D_D1": "16 q2'(t)",
    "Tr_D_fourth": "32 q4(t)",
    "Tr_D_squared": "32 q2(t)",
    "branch_factors": {
      "-2": "1-t",
      "-4": "1-2t",
      "2": "1+t"
    },
    "matrix_reconstruction_exact": true,
    "q2": "3-4t+6t^2",
    "q2_coefficients_ascending": [
      "3",
      "-4",
      "6"
    ],
    "q4": "3-8t+36t^2-32t^3+18t^4",
    "q4_coefficients_ascending": [
      "3",
      "-8",
      "36",
      "-32",
      "18"
    ]
  },
  "field_space_geometry": {
    "conditional_t_kinetic_term_closed": true,
    "coordinates": [
      "h",
      "t"
    ],
    "determinant": "14h^2",